{
 "title": "Os Abolicionistas - Coleção O Cotidiano da História",
 "authors": "Antonio Augusto da Costa Faria ",
 "publisher": "Àtica",
 "price": "R$ 44,43",
 "info": "Formato 21x28, Brochura, livro em bom estado de conservação, ricamente ilustrado, páginas levemente amareladas em virtude da ação do tempo, sem grifos ou anotações. OBRA OK! Ilustrações de Negreiros. Sinopse: A escravidão marcou profundamente a história da sociedade brasileira. Por essa razão é de grande importância compreender os acontecimentos que promoveram o fim da escravatura. Prédio térreo.ISBN: 8508007159Código de Barras: 9788508007158Origem: NacionalIdioma: PortuguêsCategoria: LivrosAutor: Antonio Augusto da Costa Faria - Edgard Luiz de BarrosTítulo: Os Abolicionistas - Coleção O Cotidiano da HistóriaEditora: ÀticaEdição: 7ªª EdiçãoAno: 1994Assunto: InfantojuvenilPáginas: 32Peso: 400 gramasConservação: Produto Usado",
 "year": "1994",
 "isbn": "9788508007158",
 "edition": "7",
 "pages": "32",
 "language": "Português"
}