{
 "title": "Direito Sumular Stj - Súmulas Interpretadas e Comentadas - - 2ª Ed. 2017",
 "authors": [
  "Alice Saldanha Villar"
 ],
 "publisher": "Jh Mizuno",
 "price": "R$ 231,00",
 "info": "Direito Sumular Stj - Súmulas Interpretadas e Comentadas - - 2ª Ed. 2017 Villar ,Alice Saldanha Editora: J. H. Mizuno ISBN13: 9788577893096 Edição: 2ª Edição - 2017 Número de Páginas: 1002 Acabamento: BROCHURA Formato: 17.00 x 24.00 cm. \"A obra ingressa no panorama editorial brasileiro com a certeza de sucesso imediato, dado que atende às necessidades e expectativas dos mais variados públicos. Estudantes, profissionais da advocacia, magistrados e todos os que lidam diuturnamente com a enorme produção jurisprudencial do STJ ganham agora uma segura bússola para as suas jornadas.\"Do Prefácio, do Ministro Luiz FuxMinistro do Supremo Tribunal Federal Professor titular de Direito Processual da Universidade do Estado do Rio de Janeiro (UERJ)\"Nesta obra, a autora apresenta com didática e clareza os fundamentos que conduziram a edição de cada verbete sumular, com sínteses conclusivas e referências jurisprudenciais, doutrinárias e legislativas. Estou convicto de que \"Direito Sumular-STJ\" de Alice Saldanha Villar terá ampla aceitação como referência essencial ao Direito Sumular brasileiro.\"Nagib Slaibi FilhoDesembargador Presidente da 6ª Câmara Cível do Tribunal de Justiça do Estado do Rio de JaneiroCoordenador e Professor de Direito Constitucional da Escola da Magistratura do Estado do Rio de Janeiro (EMERJ)\"Através do texto de leitura agradável e objetiva, a autora conseguiu abrir na confusa floresta da jurisprudência claras e amplas veredas, o que torna sua obra um excelente instrumento de consulta para a comunidade acadêmica e forense. Não é tarefa fácil descortinar a lógica com que trilham os julgados, que sempre trazem consigo o objetivo de atender aos reclamos da sociedade moderna e, assim, assegurando o ideal de justiça. Trata-se de trabalho duradouro, desses que resistem à impiedosa e devastadora força do tempo.\"Celso Ferreira FilhoDesembargador Terceiro Vice-Presidente do Tribunal de Justiça do Estado do Rio de JaneiroPresidente da Comissão da banca examinadora de Direito Civil, Direito Processual Civil, Direito do Consumidor e Direito da Criança e do Adolescente do concurso para ingresso na carreira da Magistratura do TJ/RJ",
 "year": "2017",
 "isbn": "9788577893096",
 "edition": "2ª Edição",
 "pages": "1002",
 "language": "Português"
}