{
 "title": "Antes, o Verão - Carlos HeitCony - 8571645280",
 "authors": "Carlos HeitCony",
 "publisher": "Compainha das letras",
 "price": "R$ 61,27",
 "info": "formato 14 x 21 cm . brochura. Descrição Antes, o verão, agora na 9ª edição, é considerado um dos livros mais marcantes e líricos de Carlos HeitCony. Conta a história de um homem na faixa dos 40 anos que constrói uma bela casa de frente para o mar, em Cabo Frio, litoral do Rio de Janeiro, para morar com a mulher, Maria Clara, e os filhos. Bem-sucedido nos negócios, Luís é um homem que se julga independente e que escapou da influência do poderoso sogro, um empresário que desaprovara a união com Maria Clara. E a construção da nova casa parecia refletir o auge de sua vida profissional e pessoal. Já instalados em Cabo Frio, Luís e Maria Clara amam-se como nos tempos de recém-casados. Mas nem tudo corre como planejado. Construída em local desabrigado, praticamente de-serto, a casa não resiste aos ventos da região, que carregam areia e minúsculos grãos de sal para todos os cômodos. Assim como a casa, seu casamento também começa a ruir. Na opinião de Otto Maria Carpeaux, Antes, o verão, publicado em 1964, alçou Cony ao patamar de autores como Sartre, Beckett e Moravia. Chegou a ser adaptado para o cinema em 1968.ISBN: 8571645280Código de Barras: 9788571645288Origem: NacionalIdioma: PortuguêsCategoria: LivrosAutor: Carlos HeitConyTítulo: Antes, o VerãoEditora: Compainha das letrasEdição: 5ª EdiçãoAno: 1996Assunto: Literatura BrasileiraPáginas: 189Peso: 900 gramasConservação: Produto Usado",
 "year": "1996",
 "isbn": "9788571645288",
 "edition": "5",
 "pages": "189",
 "language": "Português"
}